{
  "model_version": "0.1.0",
  "model_family": "inc15c1-dhs-source-reconciliation",
  "source_baseline_commit": "f34b82c1d3ebfede1ae8b54e84c73f211f43f3bb",
  "canonical_department_id": "ORG-FED-EXE-DEP-DHS",
  "canonical_department_crosswalk_id": "INC15-XWALK-ORG-FED-EXE-DEP-DHS",
  "publisher_source_id": "CENSUS-SRC-DHS-CHART-2025",
  "publisher_source_url": "https://www.dhs.gov/sites/default/files/2025-02/2025_0117_dhs_annual_performance_report_fy2024.pdf",
  "publisher_name": "Department of Homeland Security",
  "publisher_document": "DHS FY2024 Annual Performance Report",
  "publisher_edition_date": "2025-01-17",
  "publisher_edition_year": "FY2024",
  "original_chart_locator": "Organizational Chart, p. 24",
  "original_snapshot_id": "CENSUS-SNAPSHOT-DHS-CHART-2025",
  "source_model_observed_on": "2026-10-16",
  "original_publisher_pdf_sha256": null,
  "original_publisher_pdf_bytes": null,
  "original_publisher_custody_qualified": false,
  "source_capture_status": "external_pdf_HTTP_403_original_bytes_not_archived",
  "source_originals_pin_status": "canonical_git_objects_only_not_publisher_original",
  "source_scope": "ten_prior_arficoa_chart_candidate_records_not_all_publisher_members",
  "existing_source_candidate_count": 10,
  "reconciled_original_candidate_count": 10,
  "original_relation_count": 10,
  "inc12_original_observation_count": 10,
  "new_legally_qualified_institution_count": 0,
  "full_current_first_level_denominator": null,
  "complete_publisher_chart_census_verified": false,
  "legal_review_complete": false,
  "adl1_certified_count": 0,
  "source_population_additive_to_other_editions": false,
  "observations": [
    {
      "id": "INC15C1-OBS-CENSUS-COMP-DHS-CBP",
      "source_candidate_id": "CENSUS-COMP-DHS-CBP",
      "display_name": "U.S. Customs and Border Protection",
      "canonical_parent_id": "ORG-FED-EXE-DEP-DHS",
      "original_relationship_id": "CENSUS-REL-0010",
      "original_relation_kind": "agency_directory_or_chart_membership",
      "inc12_observation_id": "X12-OBS-CENSUS-COMP-DHS-CBP",
      "source_id": "CENSUS-SRC-DHS-CHART-2025",
      "source_snapshot_id": "CENSUS-SNAPSHOT-DHS-CHART-2025",
      "source_locator": "DHS FY2024 Annual Performance Report, organization chart, p. 24",
      "provisional_kind": "department_component",
      "independent_oversight_exception": false,
      "coast_guard_transfer_exception": false,
      "source_record_claim": "previously_researched_edition_candidate_not_independently_recaptured",
      "qualified_current_institution_id": null,
      "source_publisher_independently_archived": false,
      "current_membership_verified": false,
      "command_verified": false,
      "legal_delegation_verified": false,
      "appropriation_verified": false,
      "adl1_certified": false
    },
    {
      "id": "INC15C1-OBS-CENSUS-COMP-DHS-ICE",
      "source_candidate_id": "CENSUS-COMP-DHS-ICE",
      "display_name": "U.S. Immigration and Customs Enforcement",
      "canonical_parent_id": "ORG-FED-EXE-DEP-DHS",
      "original_relationship_id": "CENSUS-REL-0011",
      "original_relation_kind": "agency_directory_or_chart_membership",
      "inc12_observation_id": "X12-OBS-CENSUS-COMP-DHS-ICE",
      "source_id": "CENSUS-SRC-DHS-CHART-2025",
      "source_snapshot_id": "CENSUS-SNAPSHOT-DHS-CHART-2025",
      "source_locator": "DHS FY2024 Annual Performance Report, organization chart, p. 24",
      "provisional_kind": "department_component",
      "independent_oversight_exception": false,
      "coast_guard_transfer_exception": false,
      "source_record_claim": "previously_researched_edition_candidate_not_independently_recaptured",
      "qualified_current_institution_id": null,
      "source_publisher_independently_archived": false,
      "current_membership_verified": false,
      "command_verified": false,
      "legal_delegation_verified": false,
      "appropriation_verified": false,
      "adl1_certified": false
    },
    {
      "id": "INC15C1-OBS-CENSUS-COMP-DHS-USCIS",
      "source_candidate_id": "CENSUS-COMP-DHS-USCIS",
      "display_name": "U.S. Citizenship and Immigration Services",
      "canonical_parent_id": "ORG-FED-EXE-DEP-DHS",
      "original_relationship_id": "CENSUS-REL-0012",
      "original_relation_kind": "agency_directory_or_chart_membership",
      "inc12_observation_id": "X12-OBS-CENSUS-COMP-DHS-USCIS",
      "source_id": "CENSUS-SRC-DHS-CHART-2025",
      "source_snapshot_id": "CENSUS-SNAPSHOT-DHS-CHART-2025",
      "source_locator": "DHS FY2024 Annual Performance Report, organization chart, p. 24",
      "provisional_kind": "department_component",
      "independent_oversight_exception": false,
      "coast_guard_transfer_exception": false,
      "source_record_claim": "previously_researched_edition_candidate_not_independently_recaptured",
      "qualified_current_institution_id": null,
      "source_publisher_independently_archived": false,
      "current_membership_verified": false,
      "command_verified": false,
      "legal_delegation_verified": false,
      "appropriation_verified": false,
      "adl1_certified": false
    },
    {
      "id": "INC15C1-OBS-CENSUS-COMP-DHS-CISA",
      "source_candidate_id": "CENSUS-COMP-DHS-CISA",
      "display_name": "Cybersecurity and Infrastructure Security Agency",
      "canonical_parent_id": "ORG-FED-EXE-DEP-DHS",
      "original_relationship_id": "CENSUS-REL-0013",
      "original_relation_kind": "agency_directory_or_chart_membership",
      "inc12_observation_id": "X12-OBS-CENSUS-COMP-DHS-CISA",
      "source_id": "CENSUS-SRC-DHS-CHART-2025",
      "source_snapshot_id": "CENSUS-SNAPSHOT-DHS-CHART-2025",
      "source_locator": "DHS FY2024 Annual Performance Report, organization chart, p. 24",
      "provisional_kind": "department_component",
      "independent_oversight_exception": false,
      "coast_guard_transfer_exception": false,
      "source_record_claim": "previously_researched_edition_candidate_not_independently_recaptured",
      "qualified_current_institution_id": null,
      "source_publisher_independently_archived": false,
      "current_membership_verified": false,
      "command_verified": false,
      "legal_delegation_verified": false,
      "appropriation_verified": false,
      "adl1_certified": false
    },
    {
      "id": "INC15C1-OBS-CENSUS-COMP-DHS-FEMA",
      "source_candidate_id": "CENSUS-COMP-DHS-FEMA",
      "display_name": "Federal Emergency Management Agency",
      "canonical_parent_id": "ORG-FED-EXE-DEP-DHS",
      "original_relationship_id": "CENSUS-REL-0014",
      "original_relation_kind": "agency_directory_or_chart_membership",
      "inc12_observation_id": "X12-OBS-CENSUS-COMP-DHS-FEMA",
      "source_id": "CENSUS-SRC-DHS-CHART-2025",
      "source_snapshot_id": "CENSUS-SNAPSHOT-DHS-CHART-2025",
      "source_locator": "DHS FY2024 Annual Performance Report, organization chart, p. 24",
      "provisional_kind": "department_component",
      "independent_oversight_exception": false,
      "coast_guard_transfer_exception": false,
      "source_record_claim": "previously_researched_edition_candidate_not_independently_recaptured",
      "qualified_current_institution_id": null,
      "source_publisher_independently_archived": false,
      "current_membership_verified": false,
      "command_verified": false,
      "legal_delegation_verified": false,
      "appropriation_verified": false,
      "adl1_certified": false
    },
    {
      "id": "INC15C1-OBS-CENSUS-COMP-DHS-TSA",
      "source_candidate_id": "CENSUS-COMP-DHS-TSA",
      "display_name": "Transportation Security Administration",
      "canonical_parent_id": "ORG-FED-EXE-DEP-DHS",
      "original_relationship_id": "CENSUS-REL-0015",
      "original_relation_kind": "agency_directory_or_chart_membership",
      "inc12_observation_id": "X12-OBS-CENSUS-COMP-DHS-TSA",
      "source_id": "CENSUS-SRC-DHS-CHART-2025",
      "source_snapshot_id": "CENSUS-SNAPSHOT-DHS-CHART-2025",
      "source_locator": "DHS FY2024 Annual Performance Report, organization chart, p. 24",
      "provisional_kind": "department_component",
      "independent_oversight_exception": false,
      "coast_guard_transfer_exception": false,
      "source_record_claim": "previously_researched_edition_candidate_not_independently_recaptured",
      "qualified_current_institution_id": null,
      "source_publisher_independently_archived": false,
      "current_membership_verified": false,
      "command_verified": false,
      "legal_delegation_verified": false,
      "appropriation_verified": false,
      "adl1_certified": false
    },
    {
      "id": "INC15C1-OBS-CENSUS-COMP-DHS-USSS",
      "source_candidate_id": "CENSUS-COMP-DHS-USSS",
      "display_name": "U.S. Secret Service",
      "canonical_parent_id": "ORG-FED-EXE-DEP-DHS",
      "original_relationship_id": "CENSUS-REL-0016",
      "original_relation_kind": "agency_directory_or_chart_membership",
      "inc12_observation_id": "X12-OBS-CENSUS-COMP-DHS-USSS",
      "source_id": "CENSUS-SRC-DHS-CHART-2025",
      "source_snapshot_id": "CENSUS-SNAPSHOT-DHS-CHART-2025",
      "source_locator": "DHS FY2024 Annual Performance Report, organization chart, p. 24",
      "provisional_kind": "department_component",
      "independent_oversight_exception": false,
      "coast_guard_transfer_exception": false,
      "source_record_claim": "previously_researched_edition_candidate_not_independently_recaptured",
      "qualified_current_institution_id": null,
      "source_publisher_independently_archived": false,
      "current_membership_verified": false,
      "command_verified": false,
      "legal_delegation_verified": false,
      "appropriation_verified": false,
      "adl1_certified": false
    },
    {
      "id": "INC15C1-OBS-CENSUS-COMP-DHS-USCG",
      "source_candidate_id": "CENSUS-COMP-DHS-USCG",
      "display_name": "U.S. Coast Guard",
      "canonical_parent_id": "ORG-FED-EXE-DEP-DHS",
      "original_relationship_id": "CENSUS-REL-0017",